{
  "schemaVersion": 1,
  "generatedBy": "bun run ui:legacy-styles:generate",
  "scope": {
    "mode": "official",
    "repositories": [
      "bakin",
      "bakin-bits-official"
    ],
    "compatibilityMatrix": "design-system/compatibility.json"
  },
  "rules": [
    "raw-palette",
    "arbitrary-size",
    "raw-scale",
    "raw-control",
    "inline-style",
    "generic-token",
    "unscoped-css",
    "private-import"
  ],
  "summary": {
    "paths": 161,
    "totals": {
      "raw-palette": 4,
      "arbitrary-size": 77,
      "raw-scale": 422,
      "raw-control": 17,
      "inline-style": 33,
      "generic-token": 72,
      "unscoped-css": 0,
      "private-import": 0
    }
  },
  "entries": [
    {
      "path": "bakin-bits-official/plugins/messaging/components/brainstorm-view.tsx",
      "owner": {
        "repository": "bakin-bits-official",
        "area": "plugin",
        "pluginId": "messaging"
      },
      "censusEntryId": "plugin-route:messaging:/messaging/brainstorm",
      "migrationTask": "T67-T68",
      "archetype": "conversation",
      "target": "official Messaging archetypes and supported SDK UI",
      "status": "legacy-allowed",
      "allowances": {
        "arbitrary-size": 1,
        "raw-scale": 10,
        "inline-style": 1
      }
    },
    {
      "path": "bakin-bits-official/plugins/messaging/components/content-calendar.tsx",
      "owner": {
        "repository": "bakin-bits-official",
        "area": "plugin",
        "pluginId": "messaging"
      },
      "censusEntryId": "plugin-route:messaging:/messaging/calendar",
      "migrationTask": "T67-T68",
      "archetype": "conversation",
      "target": "official Messaging archetypes and supported SDK UI",
      "status": "legacy-allowed",
      "allowances": {
        "arbitrary-size": 1,
        "raw-scale": 2
      }
    },
    {
      "path": "bakin-bits-official/plugins/messaging/components/deliverable-drawer.tsx",
      "owner": {
        "repository": "bakin-bits-official",
        "area": "plugin",
        "pluginId": "messaging"
      },
      "censusEntryId": "plugin-route:messaging:/messaging/plans",
      "migrationTask": "T67-T68",
      "archetype": "conversation",
      "target": "official Messaging archetypes and supported SDK UI",
      "status": "legacy-allowed",
      "allowances": {
        "raw-scale": 6
      }
    },
    {
      "path": "bakin-bits-official/plugins/messaging/components/plan-list.tsx",
      "owner": {
        "repository": "bakin-bits-official",
        "area": "plugin",
        "pluginId": "messaging"
      },
      "censusEntryId": "plugin-route:messaging:/messaging/plans",
      "migrationTask": "T67-T68",
      "archetype": "conversation",
      "target": "official Messaging archetypes and supported SDK UI",
      "status": "legacy-allowed",
      "allowances": {
        "arbitrary-size": 1
      }
    },
    {
      "path": "bakin-bits-official/plugins/messaging/components/plan-workspace.tsx",
      "owner": {
        "repository": "bakin-bits-official",
        "area": "plugin",
        "pluginId": "messaging"
      },
      "censusEntryId": "plugin-route:messaging:/messaging/plans",
      "migrationTask": "T67-T68",
      "archetype": "conversation",
      "target": "official Messaging archetypes and supported SDK UI",
      "status": "legacy-allowed",
      "allowances": {
        "arbitrary-size": 2,
        "raw-scale": 13,
        "inline-style": 1
      }
    },
    {
      "path": "bakin-bits-official/plugins/messaging/components/quick-post-button.tsx",
      "owner": {
        "repository": "bakin-bits-official",
        "area": "plugin",
        "pluginId": "messaging"
      },
      "censusEntryId": "plugin-route:messaging:/messaging/plans",
      "migrationTask": "T67-T68",
      "archetype": "conversation",
      "target": "official Messaging archetypes and supported SDK UI",
      "status": "legacy-allowed",
      "allowances": {
        "raw-scale": 2
      }
    },
    {
      "path": "bakin-bits-official/plugins/projects/components/plan-history.tsx",
      "owner": {
        "repository": "bakin-bits-official",
        "area": "plugin",
        "pluginId": "projects"
      },
      "censusEntryId": "plugin-route:projects:/projects",
      "migrationTask": "T69-T70",
      "archetype": "detail",
      "target": "official Projects list/detail/form archetypes and supported SDK UI",
      "status": "legacy-allowed",
      "allowances": {
        "raw-scale": 1
      }
    },
    {
      "path": "bakin-bits-official/plugins/projects/components/project-detail.tsx",
      "owner": {
        "repository": "bakin-bits-official",
        "area": "plugin",
        "pluginId": "projects"
      },
      "censusEntryId": "plugin-route:projects:/projects/[id]",
      "migrationTask": "T69-T70",
      "archetype": "detail",
      "target": "official Projects list/detail/form archetypes and supported SDK UI",
      "status": "legacy-allowed",
      "allowances": {
        "arbitrary-size": 1,
        "raw-scale": 6,
        "inline-style": 1
      }
    },
    {
      "path": "bakin-bits-official/plugins/projects/components/project-list.tsx",
      "owner": {
        "repository": "bakin-bits-official",
        "area": "plugin",
        "pluginId": "projects"
      },
      "censusEntryId": "plugin-route:projects:/projects",
      "migrationTask": "T69-T70",
      "archetype": "detail",
      "target": "official Projects list/detail/form archetypes and supported SDK UI",
      "status": "legacy-allowed",
      "allowances": {
        "arbitrary-size": 1
      }
    },
    {
      "path": "packages/host/src/components/layout/app-sidebar.tsx",
      "owner": {
        "repository": "bakin",
        "area": "host"
      },
      "censusEntryId": "shared-component:packages/host/src/components/layout/app-sidebar",
      "migrationTask": "T44",
      "archetype": "shell",
      "target": "canonical shell layout and namespaced semantic tokens",
      "status": "legacy-allowed",
      "allowances": {
        "raw-scale": 5
      }
    },
    {
      "path": "packages/host/src/components/layout/connection-dot.tsx",
      "owner": {
        "repository": "bakin",
        "area": "host"
      },
      "censusEntryId": "shared-component:packages/host/src/components/layout/connection-dot",
      "migrationTask": "T44",
      "archetype": "shell",
      "target": "canonical shell layout and namespaced semantic tokens",
      "status": "legacy-allowed",
      "allowances": {
        "raw-scale": 1
      }
    },
    {
      "path": "packages/host/src/components/layout/dispatch-timer.tsx",
      "owner": {
        "repository": "bakin",
        "area": "host"
      },
      "censusEntryId": "shared-component:packages/host/src/components/layout/dispatch-timer",
      "migrationTask": "T44",
      "archetype": "shell",
      "target": "canonical shell layout and namespaced semantic tokens",
      "status": "legacy-allowed",
      "allowances": {
        "raw-scale": 3
      }
    },
    {
      "path": "packages/host/src/components/layout/header.tsx",
      "owner": {
        "repository": "bakin",
        "area": "host"
      },
      "censusEntryId": "shared-component:packages/host/src/components/layout/header",
      "migrationTask": "T44",
      "archetype": "shell",
      "target": "canonical shell layout and namespaced semantic tokens",
      "status": "legacy-allowed",
      "allowances": {
        "raw-scale": 17
      }
    },
    {
      "path": "packages/host/src/components/layout/layout-shell.tsx",
      "owner": {
        "repository": "bakin",
        "area": "host"
      },
      "censusEntryId": "shared-component:packages/host/src/components/layout/layout-shell",
      "migrationTask": "T44",
      "archetype": "shell",
      "target": "canonical shell layout and namespaced semantic tokens",
      "status": "legacy-allowed",
      "allowances": {
        "raw-scale": 2
      }
    },
    {
      "path": "packages/host/src/components/layout/notification-toggle.tsx",
      "owner": {
        "repository": "bakin",
        "area": "host"
      },
      "censusEntryId": "shared-component:packages/host/src/components/layout/notification-toggle",
      "migrationTask": "T44",
      "archetype": "shell",
      "target": "canonical shell layout and namespaced semantic tokens",
      "status": "legacy-allowed",
      "allowances": {
        "raw-scale": 2
      }
    },
    {
      "path": "packages/host/src/components/layout/sidebar-nav-item.tsx",
      "owner": {
        "repository": "bakin",
        "area": "host"
      },
      "censusEntryId": "shared-component:packages/host/src/components/layout/sidebar-nav-item",
      "migrationTask": "T44",
      "archetype": "shell",
      "target": "canonical shell layout and namespaced semantic tokens",
      "status": "legacy-allowed",
      "allowances": {
        "raw-scale": 14
      }
    },
    {
      "path": "packages/host/src/components/layout/sidebar-promo.tsx",
      "owner": {
        "repository": "bakin",
        "area": "host"
      },
      "censusEntryId": "shared-component:packages/host/src/components/layout/sidebar-promo",
      "migrationTask": "T44",
      "archetype": "shell",
      "target": "canonical shell layout and namespaced semantic tokens",
      "status": "legacy-allowed",
      "allowances": {
        "raw-scale": 6
      }
    },
    {
      "path": "packages/host/src/components/not-found.tsx",
      "owner": {
        "repository": "bakin",
        "area": "host"
      },
      "censusEntryId": "shared-component:packages/host/src/components/not-found",
      "migrationTask": "T47",
      "archetype": "shell",
      "target": "supported host UI and namespaced semantic tokens",
      "status": "legacy-allowed",
      "allowances": {
        "raw-scale": 3
      }
    },
    {
      "path": "packages/host/src/components/runtime/capabilities-tab.tsx",
      "owner": {
        "repository": "bakin",